<!ELEMENT clientela (cliente)+>
<!ELEMENT cliente (nombre, apellidos, direccion, telefono)>
<!ELEMENT nombre (#PCDATA)>
<!ELEMENT apellidos (#PCDATA)>
<!ELEMENT direccion (#PCDATA)>
<!ATTLIST direccion
        piso CDATA #REQUIRED
        puerta CDATA #REQUIRED>
<!ELEMENT telefono (#PCDATA)>

